{
  "$schema": "https://json-schema.org/draft/2020-12/schema",
  "$id": "https://goreecloud.dev/schemas/glaze/v1.7.1-section48-field-qualification-plan.schema.json",
  "title": "Glaze V1.7.1 Section 48 Field Evidence Qualification Plan",
  "type": "object",
  "additionalProperties": false,
  "required": [
    "$schema",
    "schemaVersion",
    "planId",
    "name",
    "lifecycle",
    "successorReleaseLine",
    "developmentIdentity",
    "sourceRevision",
    "sourceModelVersion",
    "section48QualificationModelVersion",
    "stableBaseline",
    "historicalSourceStableBaseline",
    "consumerEligible",
    "evidenceTypes",
    "laneIdsByEvidenceType",
    "companionMethodControls",
    "companionEvidenceAutomaticallyInherited",
    "commonRecordRules",
    "humanRules",
    "deviceRules",
    "assistiveTechnologyRules",
    "performanceRules",
    "energyRules",
    "requiredSection48Coverage",
    "implementation",
    "currentBoundary",
    "boundary"
  ],
  "properties": {
    "$schema": {
      "const": "../../schemas/v1.7.1-section48-field-qualification-plan.schema.json"
    },
    "schemaVersion": {
      "const": 1
    },
    "planId": {
      "const": "goreecloud.glaze.v1.7.1.section48-field-qualification"
    },
    "name": {
      "type": "string",
      "minLength": 1
    },
    "lifecycle": {
      "const": "DevelopmentQualification"
    },
    "successorReleaseLine": {
      "const": "1.7.1"
    },
    "developmentIdentity": {
      "const": "1.7.1-dev.1"
    },
    "sourceRevision": {
      "const": "4b9d085a5177b96cc31d4270b38d792a59872e37"
    },
    "sourceModelVersion": {
      "const": "1.7.0-dev.47"
    },
    "section48QualificationModelVersion": {
      "const": "1.7.0-dev.47"
    },
    "stableBaseline": {
      "const": "1.7.0"
    },
    "historicalSourceStableBaseline": {
      "const": "1.6.0"
    },
    "consumerEligible": {
      "const": false
    },
    "evidenceTypes": {
      "const": [
        "human",
        "device",
        "assistive-technology",
        "performance",
        "energy"
      ]
    },
    "laneIdsByEvidenceType": {
      "type": "object",
      "additionalProperties": false,
      "required": [
        "human",
        "device",
        "assistive-technology",
        "performance",
        "energy"
      ],
      "properties": {
        "human": {
          "type": "array",
          "minItems": 20,
          "maxItems": 20,
          "uniqueItems": true,
          "items": {
            "type": "string"
          }
        },
        "device": {
          "type": "array",
          "minItems": 6,
          "maxItems": 6,
          "uniqueItems": true,
          "items": {
            "type": "string"
          }
        },
        "assistive-technology": {
          "type": "array",
          "minItems": 6,
          "maxItems": 6,
          "uniqueItems": true,
          "items": {
            "type": "string"
          }
        },
        "performance": {
          "const": [
            "performance-v13"
          ]
        },
        "energy": {
          "const": [
            "energy-v13"
          ]
        }
      }
    },
    "companionMethodControls": {
      "type": "object",
      "minProperties": 5
    },
    "companionEvidenceAutomaticallyInherited": {
      "const": false
    },
    "commonRecordRules": {
      "type": "object",
      "minProperties": 10
    },
    "humanRules": {
      "type": "object",
      "minProperties": 8
    },
    "deviceRules": {
      "type": "object",
      "minProperties": 7
    },
    "assistiveTechnologyRules": {
      "type": "object",
      "minProperties": 7
    },
    "performanceRules": {
      "type": "object",
      "minProperties": 9
    },
    "energyRules": {
      "type": "object",
      "minProperties": 8
    },
    "requiredSection48Coverage": {
      "type": "object",
      "required": [
        "surfaceIds",
        "truthBoundaries",
        "accessibilityModes",
        "continuityModes"
      ],
      "properties": {
        "surfaceIds": {
          "type": "array",
          "minItems": 12,
          "uniqueItems": true,
          "items": {
            "type": "string"
          }
        },
        "truthBoundaries": {
          "type": "array",
          "minItems": 3,
          "uniqueItems": true,
          "items": {
            "type": "string"
          }
        },
        "accessibilityModes": {
          "type": "array",
          "minItems": 5,
          "uniqueItems": true,
          "items": {
            "type": "string"
          }
        },
        "continuityModes": {
          "type": "array",
          "minItems": 3,
          "uniqueItems": true,
          "items": {
            "type": "string"
          }
        }
      }
    },
    "implementation": {
      "type": "object",
      "minProperties": 5
    },
    "currentBoundary": {
      "type": "object",
      "minProperties": 12
    },
    "boundary": {
      "type": "string",
      "minLength": 1
    }
  }
}
